{
  "contract_version": "hidden_oracle_rank_usefulness_analysis_v0_1",
  "fixture_status": "synthetic_contract_fixture",
  "created_at": "2026-05-29T11:13:51Z",
  "phase": "hidden_oracle_rank_usefulness_analysis",
  "runtime_allowed": false,
  "runtime_listener_evidence_connected": false,
  "production_mission_generation_allowed": false,
  "canonical_graph_mutation_allowed": false,
  "listener_preference_inference_from_affinity_allowed": false,
  "opportunity_only": true,
  "selector_may_read_hidden_oracle": false,
  "evaluator_may_read_hidden_oracle_after_selection": true,
  "source_hidden_oracle_evaluation_design_ref": "data/product_contracts/mission_opportunity_selection_v0_1/fixtures/profile_simulation/hidden_oracle_evaluation_design_v0_1.json",
  "analysis_scope": {
    "analysis_subject": "selected_opportunity_rank_order",
    "rank_window": 10,
    "rank_score_field": "selected_opportunity_ref.final_opportunity_score",
    "usefulness_score_field": "expected_metrics.learning_usefulness_score",
    "hidden_oracle_use": "post_selection_metrics_only",
    "selector_input_rule": "visible_evidence_only",
    "construction_simulation_status": "not_implemented",
    "candidate_song_selection_status": "not_in_scope",
    "allowed_outputs": [
      "rank_rows",
      "rank_usefulness_metrics",
      "mission_type_usefulness_summary",
      "aggregate_rank_alignment",
      "review_notes"
    ]
  },
  "aggregate_summary": {
    "profile_count": 3,
    "mean_top1_learning_usefulness_score": 0.6756,
    "mean_best_learning_usefulness_score": 0.7313,
    "mean_rank_regret": 0.0557,
    "top1_is_best_count": 2,
    "best_in_top3_count": 3,
    "best_in_top5_count": 3,
    "mean_spearman_rank_correlation": 0.0747,
    "mean_ndcg_at_3": 0.8778,
    "mean_ndcg_at_5": 0.9152,
    "mean_ndcg_at_10": 0.9631,
    "alignment_label": "mixed",
    "aggregate_findings": [
      "Oracle-usefulness best item is in top 3 for 3/3 profiles.",
      "Oracle-usefulness best item is in top 5 for 3/3 profiles.",
      "Selector top rank is not always oracle-best; later portfolio selection should preserve the top window.",
      "Mean rank regret is modest in the accepted synthetic profile set."
    ]
  },
  "profiles": [
    {
      "profile_id": "public_profile_01",
      "selector_output_ref": "data/product_contracts/mission_opportunity_selection_v0_1/fixtures/profile_simulation/public_profile_01_selector_output_v0_1.json",
      "evaluation_design_profile_ref": "data/product_contracts/mission_opportunity_selection_v0_1/fixtures/profile_simulation/hidden_oracle_evaluation_design_v0_1.json#public_profile_01",
      "rank_window": 10,
      "top_selector_opportunity": {
        "opportunity_id": "opp_profile-01_boundary_test_mixed_nearby_boundary_eligible_00",
        "rank": 1,
        "mission_type": "boundary_test",
        "target_object_type": "archetype_pair",
        "target_object_ids": [
          "016",
          "106"
        ],
        "target_display_name": "Visible Archetype 016 -> Visible Archetype 106",
        "selector_score": 0.9098,
        "learning_usefulness_score": 0.7537
      },
      "best_oracle_usefulness_opportunity": {
        "opportunity_id": "opp_profile-01_boundary_test_mixed_nearby_boundary_eligible_00",
        "rank": 1,
        "mission_type": "boundary_test",
        "target_object_type": "archetype_pair",
        "target_object_ids": [
          "016",
          "106"
        ],
        "target_display_name": "Visible Archetype 016 -> Visible Archetype 106",
        "selector_score": 0.9098,
        "learning_usefulness_score": 0.7537
      },
      "top1_learning_usefulness_score": 0.7537,
      "best_learning_usefulness_score": 0.7537,
      "rank_regret": 0.0,
      "best_usefulness_rank": 1,
      "top1_is_best": true,
      "best_in_top3": true,
      "best_in_top5": true,
      "spearman_rank_correlation": 0.2727,
      "ndcg_at_3": 0.9447,
      "ndcg_at_5": 0.9478,
      "ndcg_at_10": 0.9804,
      "rank_rows": [
        {
          "rank": 1,
          "opportunity_id": "opp_profile-01_boundary_test_mixed_nearby_boundary_eligible_00",
          "mission_type": "boundary_test",
          "target_display_name": "Visible Archetype 016 -> Visible Archetype 106",
          "selector_score": 0.9098,
          "learning_usefulness_score": 0.7537,
          "usefulness_rank": 1,
          "usefulness_delta_from_top1": 0.0,
          "oracle_match_tags": [
            "primary_archetype:016",
            "unknown_targets:1"
          ]
        },
        {
          "rank": 2,
          "opportunity_id": "opp_profile-01_archetype_depth_test_strong_archetype_shallow_depth_eligible_00",
          "mission_type": "archetype_depth_test",
          "target_display_name": "Visible Archetype 016",
          "selector_score": 0.8561,
          "learning_usefulness_score": 0.5292,
          "usefulness_rank": 9,
          "usefulness_delta_from_top1": -0.2245,
          "oracle_match_tags": [
            "primary_archetype:016"
          ]
        },
        {
          "rank": 3,
          "opportunity_id": "opp_profile-01_boundary_test_mixed_nearby_boundary_eligible_02",
          "mission_type": "boundary_test",
          "target_display_name": "Visible Archetype 016 -> Visible Archetype 106 (candidate 02)",
          "selector_score": 0.8487,
          "learning_usefulness_score": 0.7421,
          "usefulness_rank": 2,
          "usefulness_delta_from_top1": -0.0116,
          "oracle_match_tags": [
            "primary_archetype:016",
            "unknown_targets:1"
          ]
        },
        {
          "rank": 4,
          "opportunity_id": "opp_profile-01_artist_depth_test_one_artist_shallow_depth_eligible_00",
          "mission_type": "artist_depth_test",
          "target_display_name": "Fleetwood Mac",
          "selector_score": 0.84,
          "learning_usefulness_score": 0.5382,
          "usefulness_rank": 7,
          "usefulness_delta_from_top1": -0.2155,
          "oracle_match_tags": [
            "unknown_targets:1"
          ]
        },
        {
          "rank": 5,
          "opportunity_id": "opp_profile-01_false_nearby_test_mixed_nearby_boundary_eligible_00",
          "mission_type": "false_nearby_test",
          "target_display_name": "Hotel California Context Cluster",
          "selector_score": 0.8179,
          "learning_usefulness_score": 0.5713,
          "usefulness_rank": 5,
          "usefulness_delta_from_top1": -0.1824,
          "oracle_match_tags": [
            "unknown_targets:1",
            "direct_song_unknown:1"
          ]
        },
        {
          "rank": 6,
          "opportunity_id": "opp_profile-01_bridge_test_bridge_source_positive_target_gap_eligible_00",
          "mission_type": "bridge_test",
          "target_display_name": "Visible Family 3 -> Visible Family 15",
          "selector_score": 0.8137,
          "learning_usefulness_score": 0.5844,
          "usefulness_rank": 4,
          "usefulness_delta_from_top1": -0.1693,
          "oracle_match_tags": [
            "unknown_targets:1",
            "false_nearby_lane_match"
          ]
        },
        {
          "rank": 7,
          "opportunity_id": "opp_profile-01_artist_depth_test_one_artist_shallow_depth_eligible_02",
          "mission_type": "artist_depth_test",
          "target_display_name": "Fleetwood Mac (candidate 02)",
          "selector_score": 0.8015,
          "learning_usefulness_score": 0.5309,
          "usefulness_rank": 8,
          "usefulness_delta_from_top1": -0.2228,
          "oracle_match_tags": [
            "unknown_targets:1"
          ]
        },
        {
          "rank": 8,
          "opportunity_id": "opp_profile-01_archetype_depth_test_strong_archetype_shallow_depth_eligible_02",
          "mission_type": "archetype_depth_test",
          "target_display_name": "Visible Archetype 016 (candidate 02)",
          "selector_score": 0.7968,
          "learning_usefulness_score": 0.5179,
          "usefulness_rank": 10,
          "usefulness_delta_from_top1": -0.2358,
          "oracle_match_tags": [
            "primary_archetype:016"
          ]
        },
        {
          "rank": 9,
          "opportunity_id": "opp_profile-01_context_dependence_test_context_heavy_signals_eligible_00",
          "mission_type": "context_dependence_test",
          "target_display_name": "Hotel California Context Cluster",
          "selector_score": 0.7604,
          "learning_usefulness_score": 0.6441,
          "usefulness_rank": 3,
          "usefulness_delta_from_top1": -0.1096,
          "oracle_match_tags": [
            "unknown_targets:1",
            "context_lane_match",
            "direct_song_unknown:1"
          ]
        },
        {
          "rank": 10,
          "opportunity_id": "opp_profile-01_false_nearby_test_mixed_nearby_boundary_eligible_02",
          "mission_type": "false_nearby_test",
          "target_display_name": "Hotel California Context Cluster (candidate 02)",
          "selector_score": 0.7582,
          "learning_usefulness_score": 0.5601,
          "usefulness_rank": 6,
          "usefulness_delta_from_top1": -0.1936,
          "oracle_match_tags": [
            "unknown_targets:1",
            "direct_song_unknown:1"
          ]
        }
      ],
      "mission_type_usefulness_summary": [
        {
          "mission_type": "boundary_test",
          "count": 2,
          "best_selector_rank": 1,
          "best_usefulness_rank": 1,
          "mean_learning_usefulness_score": 0.7479,
          "max_learning_usefulness_score": 0.7537
        },
        {
          "mission_type": "context_dependence_test",
          "count": 1,
          "best_selector_rank": 9,
          "best_usefulness_rank": 3,
          "mean_learning_usefulness_score": 0.6441,
          "max_learning_usefulness_score": 0.6441
        },
        {
          "mission_type": "bridge_test",
          "count": 1,
          "best_selector_rank": 6,